MCQ,Choices,Correct
What term was coined in 1959 by Arthur Samuel to describe the field of computer gaming and artificial intelligence?,a:Artificial Intelligence | b:Machine Learning | c:Computer Gaming | d:Self-Teaching Computers,b
"Who published the book 'The Organization of Behavior' in 1949, introducing a theoretical neural structure that influenced the development of machine learning?",a:Arthur Samuel | b:Donald Hebb | c:Walter Pitts | d:Warren McCulloch,b
"In the 1960s, which company developed an experimental 'learning machine' called Cybertron to analyze sonar signals, electrocardiograms, and speech patterns?",a:IBM | b:Raytheon Company | c:Microsoft | d:Apple,b
"According to Tom M. Mitchell, what is the definition of a computer program learning from experience with respect to tasks and performance?",a:Improving performance with experience | b:Memorizing data | c:Ignoring experience | d:Not learning from tasks,a
What are the two main objectives of modern-day machine learning mentioned in the text?,a:Solving puzzles and playing games | b:Predicting future outcomes and classifying data | c:Writing code and designing websites | d:Creating music and art,b
